{
  "id": "heart_attack",
  "owner": "Taneesha Badhe",
  "age_scope": "adult",
  "names": {
    "en": "Heart attack",
    "hi": "दिल का दौरा",
    "hinglish": "",
    "mr": ""
  },
  "recognition": [
    {
      "en": "Pain, pressure, squeezing or tightness in the chest, which may spread to the arm, jaw, neck or back; may come with breathlessness, sweating, nausea or feeling faint. Symptoms can be mild.",
      "hi": "छाती में दर्द, दबाव, भिंचाव या जकड़न, जो बाँह, जबड़े, गर्दन या पीठ तक फैल सकती है; साथ में साँस फूलना, पसीना, जी मिचलाना या बेहोशी जैसा लगना हो सकता है। लक्षण हल्के भी हो सकते हैं।",
      "hinglish": "",
      "mr": ""
    }
  ],
  "branch_on": null,
  "branches": {
    "default": {
      "urgency_rules": [
        {
          "if": {},
          "urgency": "emergency"
        }
      ],
      "steps": [
        {
          "id": "ha_s1",
          "order": 1,
          "text": {
            "en": "Call 112 now. Do not wait to see if the pain passes.",
            "hi": "अभी 112 पर कॉल करें। दर्द अपने आप जाने का इंतज़ार न करें।",
            "hinglish": "",
            "mr": ""
          },
          "source": {
            "doc": "G1",
            "page": 358,
            "quote_checked": false
          },
          "also_in": [],
          "agreement": "unchecked",
          "evidence": "unchecked",
          "next": "ha_s2",
          "verified": false,
          "verify_note": "VERIFY"
        },
        {
          "id": "ha_s2",
          "order": 2,
          "text": {
            "en": "Help them sit in the position they find most comfortable, and keep them still and calm.",
            "hi": "उन्हें उस स्थिति में बैठने में मदद करें जिसमें उन्हें सबसे ज़्यादा आराम लगे, और उन्हें स्थिर और शांत रखें।",
            "hinglish": "",
            "mr": ""
          },
          "source": {
            "doc": "G1",
            "page": 358,
            "quote_checked": false
          },
          "also_in": [],
          "agreement": "unchecked",
          "evidence": "unchecked",
          "next": "ha_s3",
          "verified": false,
          "verify_note": "VERIFY"
        },
        {
          "id": "ha_s3",
          "order": 3,
          "text": {
            "en": "Loosen tight clothing.",
            "hi": "तंग कपड़े ढीले कर दें।",
            "hinglish": "",
            "mr": ""
          },
          "source": {
            "doc": "G1",
            "page": 358,
            "quote_checked": false
          },
          "also_in": [],
          "agreement": "unchecked",
          "evidence": "unchecked",
          "next": "ha_s4",
          "verified": false,
          "verify_note": "VERIFY"
        },
        {
          "id": "ha_s4",
          "order": 4,
          "text": {
            "en": "If they are not allergic to aspirin and have not been told not to take it, give aspirin to chew.",
            "hi": "अगर उन्हें एस्पिरिन से एलर्जी नहीं है और उन्हें इसे लेने से मना नहीं किया गया है, तो चबाने के लिए एस्पिरिन दें।",
            "hinglish": "",
            "mr": ""
          },
          "source": {
            "doc": "G1",
            "page": 358,
            "quote_checked": false
          },
          "also_in": [
            {
              "doc": "G2",
              "page": null
            },
            {
              "doc": "G4",
              "page": null
            }
          ],
          "agreement": "unchecked",
          "evidence": "unchecked",
          "next": "ha_s5",
          "verified": false,
          "verify_note": "VERIFY dose: record each source's dose; the app shows the dose only after it is confirmed"
        },
        {
          "id": "ha_s5",
          "order": 5,
          "text": {
            "en": "If they have their own prescribed medicine for chest pain, help them take it.",
            "hi": "अगर उनके पास छाती के दर्द की डॉक्टर की लिखी अपनी दवा है, तो उसे लेने में उनकी मदद करें।",
            "hinglish": "",
            "mr": ""
          },
          "source": {
            "doc": "G1",
            "page": 358,
            "quote_checked": false
          },
          "also_in": [],
          "agreement": "unchecked",
          "evidence": "unchecked",
          "next": "ha_s6",
          "verified": false,
          "verify_note": "VERIFY"
        },
        {
          "id": "ha_s6",
          "order": 6,
          "text": {
            "en": "Ask someone to find an AED if one is nearby.",
            "hi": "अगर पास में AED (डिफ़िब्रिलेटर) हो, तो किसी से उसे ढूँढकर लाने को कहें।",
            "hinglish": "",
            "mr": ""
          },
          "source": {
            "doc": "G1",
            "page": 358,
            "quote_checked": false
          },
          "also_in": [],
          "agreement": "unchecked",
          "evidence": "unchecked",
          "next": "ha_s7",
          "verified": false,
          "verify_note": "VERIFY"
        },
        {
          "id": "ha_s7",
          "order": 7,
          "text": {
            "en": "Stay with them. If they become unresponsive and are not breathing normally, start CPR (Situation 9.1, Path A).",
            "hi": "उनके साथ रहें। अगर वे प्रतिक्रिया देना बंद कर दें और सामान्य रूप से साँस न लें, तो CPR शुरू करें (स्थिति 9.1, पथ A)।",
            "hinglish": "",
            "mr": ""
          },
          "source": {
            "doc": "G3",
            "page": null,
            "quote_checked": true
          },
          "also_in": [],
          "agreement": "unchecked",
          "evidence": "unchecked",
          "next": null,
          "verified": false,
          "link": {
            "situation": "unresponsive",
            "branch": "path_a"
          }
        }
      ],
      "do_not": [
        {
          "text": {
            "en": "Do not let them walk around or exert themselves.",
            "hi": "उन्हें चलने-फिरने या मेहनत करने न दें।",
            "hinglish": "",
            "mr": ""
          },
          "reason": {
            "en": "",
            "hi": "",
            "hinglish": "",
            "mr": ""
          },
          "step": "ha_s2"
        },
        {
          "text": {
            "en": "Do not give food or drink.",
            "hi": "खाने या पीने को कुछ न दें।",
            "hinglish": "",
            "mr": ""
          },
          "reason": {
            "en": "",
            "hi": "",
            "hinglish": "",
            "mr": ""
          },
          "step": "ha_s3"
        },
        {
          "text": {
            "en": "Do not treat it as gas or acidity and wait.",
            "hi": "इसे गैस या एसिडिटी समझकर इंतज़ार न करें।",
            "hinglish": "",
            "mr": ""
          },
          "reason": {
            "en": "Delay can cost a life; call 112.",
            "hi": "देरी से जान जा सकती है; 112 पर कॉल करें।",
            "hinglish": "",
            "mr": ""
          },
          "step": "ha_s1"
        },
        {
          "text": {
            "en": "Do not give aspirin if they are allergic to it.",
            "hi": "अगर उन्हें एस्पिरिन से एलर्जी है, तो एस्पिरिन न दें।",
            "hinglish": "",
            "mr": ""
          },
          "reason": {
            "en": "",
            "hi": "",
            "hinglish": "",
            "mr": ""
          },
          "step": "ha_s4"
        }
      ]
    }
  },
  "source_differences": [
    {
      "topic": "aspirin dose",
      "notes": ""
    }
  ],
  "review_status": "draft"
}
